{
  "$schema": "https://json-schema.org/draft/2020-12/schema",
  "$id": "https://astranyx.dev/schemas/finding-report-v1.json",
  "title": "Astranyx Finding Report",
  "type": "object",
  "required": ["schema_version", "metadata", "summary", "findings"],
  "properties": {
    "schema_version": {"const": 1},
    "metadata": {"type": "object"},
    "summary": {"type": "object"},
    "findings": {
      "type": "array",
      "items": {"$ref": "#/$defs/finding"}
    }
  },
  "$defs": {
    "finding": {
      "type": "object",
      "required": [
        "fingerprint", "category", "severity", "file", "line",
        "evidence", "note", "confidence", "reason", "source", "rule_id",
        "review_state", "review_note", "masvs", "masvs_mapping"
      ],
      "properties": {
        "fingerprint": {"type": "string", "pattern": "^asx-[a-f0-9]{24}$"},
        "category": {"type": "string", "minLength": 1},
        "severity": {
          "type": "string",
          "enum": ["Critical", "High", "Medium", "Low", "Info"]
        },
        "file": {"type": "string", "minLength": 1},
        "full_path": {"type": "string"},
        "line": {"type": "integer", "minimum": 1},
        "evidence": {"type": "string"},
        "note": {"type": "string"},
        "confidence": {"type": "integer", "minimum": 0, "maximum": 100},
        "reason": {"type": "string"}
        ,"source": {"type": "string", "minLength": 1}
        ,"rule_id": {"type": "string"}
        ,"review_state": {
          "type": "string",
          "enum": [
            "accepted_risk", "confirmed", "needs_validation", "not_tested",
            "rejected"
          ]
        }
        ,"review_note": {"type": "string"}
        ,"masvs": {
          "type": "array",
          "items": {"type": "string", "pattern": "^MASVS-[A-Z]+(?:-[0-9]+)?$"},
          "uniqueItems": true
        }
        ,"masvs_mapping": {
          "type": "string",
          "enum": ["inferred", "unmapped", "upstream"]
        }
      },
      "additionalProperties": false
    }
  },
  "additionalProperties": false
}
