{
  "schema_version": 1,
  "metadata": {
    "source": "mobsf",
    "app_name": "Diva",
    "package_name": "jakhar.aseem.diva",
    "scan_type": "apk",
    "normalized_findings": 42,
    "imported_sections": [
      "binary_analysis",
      "certificate_analysis",
      "code_analysis",
      "manifest_analysis",
      "network_security"
    ],
    "unsupported_sections": [
      "permissions",
      "secrets",
      "trackers"
    ],
    "client": "Demonstration Client",
    "consultant": "Astranyx Security",
    "assessment_title": "DIVA Android Security Assessment"
  },
  "summary": {
    "generated": "2026-08-28 02:32:09",
    "target": "jakhar.aseem.diva",
    "total": 42,
    "critical": 0,
    "high": 18,
    "medium": 16,
    "low": 0,
    "info": 8,
    "categories": {
      "Application signed with debug certificate": 1,
      "binary_fortify": 7,
      "Activity (jakhar.aseem.diva.APICreds2Activity) is not Protected. An intent-filter exists.": 1,
      "binary_stack_canary": 6,
      "App creates temp file. Sensitive information should never be written into a temp file.": 1,
      "Application vulnerable to Janus Vulnerability": 1,
      "Signed Application": 1,
      "binary_nx": 7,
      "App can be installed on a vulnerable unpatched Android version 4.0.3-4.0.4, [minSdk=15]": 1,
      "Content Provider (jakhar.aseem.diva.NotesProvider) is not Protected. [android:exported=true]": 1,
      "The App logs information. Sensitive information should never be logged.": 7,
      "Application Data can be Backed up [android:allowBackup=true]": 1,
      "Activity (jakhar.aseem.diva.APICredsActivity) is not Protected. An intent-filter exists.": 1,
      "App uses SQLite Database and execute raw SQL query. Untrusted user input in raw SQL queries can cause SQL Injection. Also sensitive information should be encrypted and written to the database.": 3,
      "App can read/write to External Storage. Any App can read data written to External Storage.": 1,
      "Debug Enabled For App [android:debuggable=true]": 1,
      "Debug configuration enabled. Production builds must not be debuggable.": 1
    }
  },
  "findings": [
    {
      "category": "Application signed with debug certificate",
      "severity": "High",
      "file": "signing-certificate",
      "full_path": "",
      "line": 1,
      "evidence": "Application signed with debug certificate",
      "note": "Application signed with a debug certificate. Production application must not be shipped with a debug certificate.",
      "confidence": 70,
      "reason": "Application signed with a debug certificate. Production application must not be shipped with a debug certificate.",
      "source": "mobsf",
      "rule_id": "certificate_b0d9fb2297c7",
      "review_state": "confirmed",
      "review_note": "Confirmed from the APK signing-certificate analysis; this training build uses a debug certificate.",
      "masvs": [
        "MASVS-RESILIENCE"
      ],
      "masvs_mapping": "inferred",
      "fingerprint": "asx-0105aa55ac47aeda18aa1a01"
    },
    {
      "category": "binary_fortify",
      "severity": "Medium",
      "file": "lib/armeabi/libdivajni.so",
      "full_path": "",
      "line": 1,
      "evidence": "The binary does not have any fortified functions. Fortified functions provides buffer overflow checks against glibc's commons insecure functions like strcpy, gets etc. Use the compiler option -D_FORTIFY_SOURCE=2 to fortify functions. This check is not applicable for Dart/Flutter libraries.",
      "note": "The binary does not have any fortified functions. Fortified functions provides buffer overflow checks against glibc's commons insecure functions like strcpy, gets etc. Use the compiler option -D_FORTIFY_SOURCE=2 to fortify functions. This check is not applicable for Dart/Flutter libraries.",
      "confidence": 70,
      "reason": "The binary does not have any fortified functions. Fortified functions provides buffer overflow checks against glibc's commons insecure functions like strcpy, gets etc. Use the compiler option -D_FORTIFY_SOURCE=2 to fortify functions. This check is not applicable for Dart/Flutter libraries.",
      "source": "mobsf",
      "rule_id": "binary_fortify",
      "review_state": "needs_validation",
      "review_note": "",
      "masvs": [
        "MASVS-RESILIENCE"
      ],
      "masvs_mapping": "inferred",
      "fingerprint": "asx-052f95c6189ec9ecc5b94c67"
    },
    {
      "category": "Activity (jakhar.aseem.diva.APICreds2Activity) is not Protected. An intent-filter exists.",
      "severity": "Medium",
      "file": "AndroidManifest.xml",
      "full_path": "",
      "line": 1,
      "evidence": "[\"Activity\", \"jakhar.aseem.diva.APICreds2Activity\"]",
      "note": "An Activity is found to be shared with other apps on the device therefore leaving it accessible to any other application on the device. The presence of intent-filter indicates that the Activity is explicitly exported.",
      "confidence": 70,
      "reason": "An Activity is found to be shared with other apps on the device therefore leaving it accessible to any other application on the device. The presence of intent-filter indicates that the Activity is explicitly exported.",
      "source": "mobsf",
      "rule_id": "exported_intent_filter_exists",
      "review_state": "confirmed",
      "review_note": "Confirmed by static manifest inspection: the activity has an intent filter and no protecting permission.",
      "masvs": [
        "MASVS-PLATFORM"
      ],
      "masvs_mapping": "inferred",
      "fingerprint": "asx-07f7d34d52b38eb292f406f3"
    },
    {
      "category": "binary_stack_canary",
      "severity": "High",
      "file": "lib/arm64-v8a/libdivajni.so",
      "full_path": "",
      "line": 1,
      "evidence": "This binary does not have a stack canary value added to the stack. Stack canaries are used to detect and prevent exploits from overwriting return address. Use the option -fstack-protector-all to enable stack canaries. Not applicable for Dart/Flutter libraries unless Dart FFI is used.",
      "note": "This binary does not have a stack canary value added to the stack. Stack canaries are used to detect and prevent exploits from overwriting return address. Use the option -fstack-protector-all to enable stack canaries. Not applicable for Dart/Flutter libraries unless Dart FFI is used.",
      "confidence": 70,
      "reason": "This binary does not have a stack canary value added to the stack. Stack canaries are used to detect and prevent exploits from overwriting return address. Use the option -fstack-protector-all to enable stack canaries. Not applicable for Dart/Flutter libraries unless Dart FFI is used.",
      "source": "mobsf",
      "rule_id": "binary_stack_canary",
      "review_state": "needs_validation",
      "review_note": "",
      "masvs": [
        "MASVS-RESILIENCE"
      ],
      "masvs_mapping": "inferred",
      "fingerprint": "asx-091be4ba23fac2428992cc49"
    },
    {
      "category": "App creates temp file. Sensitive information should never be written into a temp file.",
      "severity": "Medium",
      "file": "jakhar/aseem/diva/InsecureDataStorage3Activity.java",
      "full_path": "",
      "line": 26,
      "evidence": "App creates temp file. Sensitive information should never be written into a temp file.",
      "note": "App creates temp file. Sensitive information should never be written into a temp file.",
      "confidence": 70,
      "reason": "App creates temp file. Sensitive information should never be written into a temp file.",
      "source": "mobsf",
      "rule_id": "android_temp_file",
      "review_state": "needs_validation",
      "review_note": "",
      "masvs": [],
      "masvs_mapping": "unmapped",
      "fingerprint": "asx-0931e3514033de63d102c5b0"
    },
    {
      "category": "Application vulnerable to Janus Vulnerability",
      "severity": "High",
      "file": "signing-certificate",
      "full_path": "",
      "line": 1,
      "evidence": "Application vulnerable to Janus Vulnerability",
      "note": "Application is signed with v1 signature scheme, making it vulnerable to Janus vulnerability on Android 5.0-8.0, if signed only with v1 signature scheme. Applications running on Android 5.0-7.0 signed with v1, and v2/v3 scheme is also vulnerable.",
      "confidence": 70,
      "reason": "Application is signed with v1 signature scheme, making it vulnerable to Janus vulnerability on Android 5.0-8.0, if signed only with v1 signature scheme. Applications running on Android 5.0-7.0 signed with v1, and v2/v3 scheme is also vulnerable.",
      "source": "mobsf",
      "rule_id": "certificate_033faa4c2ea1",
      "review_state": "needs_validation",
      "review_note": "",
      "masvs": [
        "MASVS-RESILIENCE"
      ],
      "masvs_mapping": "inferred",
      "fingerprint": "asx-096dda1a14c4efbc5faf0135"
    },
    {
      "category": "Signed Application",
      "severity": "Info",
      "file": "signing-certificate",
      "full_path": "",
      "line": 1,
      "evidence": "Signed Application",
      "note": "Application is signed with a code signing certificate",
      "confidence": 70,
      "reason": "Application is signed with a code signing certificate",
      "source": "mobsf",
      "rule_id": "certificate_b8cfd4104871",
      "review_state": "needs_validation",
      "review_note": "",
      "masvs": [
        "MASVS-RESILIENCE"
      ],
      "masvs_mapping": "inferred",
      "fingerprint": "asx-12ac2a4d62b64ce52b26e96a"
    },
    {
      "category": "binary_nx",
      "severity": "High",
      "file": "lib/x86_64/libdivajni.so",
      "full_path": "",
      "line": 1,
      "evidence": "The binary does not have NX bit set. NX bit offer protection against exploitation of memory corruption vulnerabilities by marking memory page as non-executable. Use option --noexecstack or -z noexecstack to mark stack as non executable.",